{
  "method_id": "lc_tail4_mod80",
  "formula_id": "FC-TAIL80-001",
  "formula_version": "1.0-proposed",
  "suffix": "6231",
  "quotient": 77,
  "remainder": 71,
  "lookup_code": 71,
  "zero_policy": "unmapped",
  "table_version": "user_supplied_80_draft1",
  "source_ref": "USER_TABLE80_CONVERSATION",
  "rights_state": "unknown",
  "source_label": "Hung",
  "is_personalized": false,
  "probability": null
}
